{
  "schemaVersion": "1.0",
  "milestone": "V1.3-H",
  "targetCommit": "169c8fc",
  "baseReference": "169c8fc",
  "weights": { "contractCoverage": 30, "negativeBoundaryCoverage": 20, "verificationMutationSafety": 15, "architectureSecurity": 15, "regressionEvidence": 15, "traceability": 5 },
  "efficiency": { "workflowMode": "autonomous-milestone", "packetCount": 5, "quotaWindowPercent": null, "humanInterventions": null, "elapsedMinutes": null, "reworkCommits": null, "modelProfile": "Luna Medium" },
  "criteria": [
    { "id":"contract-identity-current", "category":"contractCoverage", "requirement":"identity.current exposes bounded user, uid/SID, elevation, service-account, groups and authentication fields.", "hardGate":true, "evidence":{"type":"exact automated test","testProject":"tests/bOps.Packages.Identity.Core.Tests/bOps.Packages.Identity.Core.Tests.csproj","testName":"IdentityContractTests"}, "status":"PENDING" },
    { "id":"contract-identity-users", "category":"contractCoverage", "requirement":"identity.users preserves nullable enabled and deterministic bounded rows.", "hardGate":true, "evidence":{"type":"exact automated test","testProject":"tests/bOps.Packages.Identity.Core.Tests/bOps.Packages.Identity.Core.Tests.csproj","testName":"Users_UnknownEnabledRemainsWhenFilteringDisabled"}, "status":"PENDING" },
    { "id":"contract-identity-groups", "category":"contractCoverage", "requirement":"identity.groups bounds direct members and reports truncation without recursive expansion.", "hardGate":true, "evidence":{"type":"exact automated test","testProject":"tests/bOps.Packages.Identity.Core.Tests/bOps.Packages.Identity.Core.Tests.csproj","testName":"Groups_AreBoundedAndExplicitlyTruncated"}, "status":"PENDING" },
    { "id":"contract-identity-sessions", "category":"contractCoverage", "requirement":"identity.sessions has bounded deterministic session rows.", "hardGate":true, "evidence":{"type":"static repository assertion","files":["src/packages/bOps.Packages.Identity.Core/IdentityResults.cs"]}, "status":"PASS" },
    { "id":"contract-system-time", "category":"contractCoverage", "requirement":"system.time exposes timezone-safe wall-clock and completeness fields.", "hardGate":true, "evidence":{"type":"static repository assertion","files":["src/packages/bOps.Packages.System.Core/TimeResults.cs"]}, "status":"PASS" },
    { "id":"contract-system-reboot", "category":"contractCoverage", "requirement":"system.reboot_pending exposes pending reasons, source and completeness.", "hardGate":true, "evidence":{"type":"static repository assertion","files":["src/packages/bOps.Packages.System.Core/TimeResults.cs"]}, "status":"PASS" },
    { "id":"bounds-and-truncation", "category":"negativeBoundaryCoverage", "requirement":"Identity limits and group truncation are enforced at the shared boundary.", "hardGate":true, "evidence":{"type":"exact automated test","testProject":"tests/bOps.Packages.Identity.Core.Tests/bOps.Packages.Identity.Core.Tests.csproj","testName":"Users_RejectsOutOfRangeLimit"}, "status":"PENDING" },
    { "id":"unknown-enabled-semantics", "category":"negativeBoundaryCoverage", "requirement":"includeDisabled=false removes only enabled=false and retains enabled=null.", "hardGate":true, "evidence":{"type":"exact automated test","testProject":"tests/bOps.Packages.Identity.Core.Tests/bOps.Packages.Identity.Core.Tests.csproj","testName":"Users_UnknownEnabledRemainsWhenFilteringDisabled"}, "status":"PENDING" },
    { "id":"unsupported-reboot-source", "category":"negativeBoundaryCoverage", "requirement":"Unsupported Linux reboot evidence is incomplete rather than false certainty.", "hardGate":true, "evidence":{"type":"static repository assertion","files":["src/packages/bOps.Packages.System.Linux/LinuxTimeTools.cs"]}, "status":"PASS" },
    { "id":"read-only-safety", "category":"verificationMutationSafety", "requirement":"H introduces only Read-risk diagnostic tools and no mutation or verification capability.", "hardGate":true, "evidence":{"type":"static repository assertion","files":["src/packages/bOps.Packages.Identity.Core/IdentityToolManifests.cs","src/packages/bOps.Packages.System.Core/SystemToolManifests.cs"]}, "status":"PASS" },
    { "id":"no-shadow-credentials", "category":"architectureSecurity", "requirement":"No shadow, password hash, credential, token, environment or AD crawl is exposed.", "hardGate":true, "evidence":{"type":"exact automated test","testProject":"tests/bOps.Packages.System.Linux.Tests/bOps.Packages.System.Linux.Tests.csproj","testName":"LocalIdentitySourcesAreBoundedAndDoNotExposeCredentialFiles"}, "status":"PENDING" },
    { "id":"core-no-os-calls", "category":"architectureSecurity", "requirement":"Identity.Core and System.Core contain contracts and shells only; OS calls remain platform-specific.", "hardGate":true, "evidence":{"type":"architecture test","testProject":"tests/bOps.Architecture.Tests/bOps.Architecture.Tests.csproj","testName":"NoGenericExecutionToolTests"}, "status":"PENDING" },
    { "id":"fixed-process-boundaries", "category":"architectureSecurity", "requirement":"Linux loginctl and timedatectl use fixed executables and bounded ArgumentList calls.", "hardGate":true, "evidence":{"type":"static repository assertion","files":["src/packages/bOps.Packages.Identity.Linux/LinuxIdentityTools.cs","src/packages/bOps.Packages.System.Linux/LinuxTimeTools.cs"]}, "status":"PASS" },
    { "id":"platform-composition", "category":"architectureSecurity", "requirement":"CLI and API compose exactly one OS-specific identity and system provider.", "hardGate":true, "evidence":{"type":"static repository assertion","files":["src/core/bOps.Cli/Program.cs","src/core/bOps.Api/Program.cs"]}, "status":"PASS" },
    { "id":"regression-release-build", "category":"regressionEvidence", "requirement":"Release solution build completes without new errors or warnings.", "hardGate":true, "evidence":{"type":"deterministic command/build","command":"dotnet build bOps.slnx --configuration Release"}, "status":"PENDING" },
    { "id":"regression-full-non-live", "category":"regressionEvidence", "requirement":"Full non-live solution suite is executed once by the quality runner.", "hardGate":true, "evidence":{"type":"deterministic command/build","command":"dotnet test bOps.slnx --configuration Release --no-build --filter Category!=LiveModel"}, "status":"PENDING" },
    { "id":"regression-architecture-gate", "category":"regressionEvidence", "requirement":"Architecture gate is included in the final quality evidence.", "hardGate":true, "evidence":{"type":"deterministic command/build","testProject":"tests/bOps.Architecture.Tests/bOps.Architecture.Tests.csproj","testName":"project gate"}, "status":"PENDING" },
    { "id":"identity-linux-platform-evidence", "category":"regressionEvidence", "requirement":"Real Linux local identity evidence is collected when the Linux target executes it.", "hardGate":true, "evidence":{"type":"platform evidence","testProject":"tests/bOps.Packages.System.Linux.Tests/bOps.Packages.System.Linux.Tests.csproj","testName":"bOps.Packages.System.Linux.Tests.LinuxIdentitySmokeTests.LocalIdentitySourcesAreBoundedAndDoNotExposeCredentialFiles","platform":"Linux"}, "status":"PENDING" },
    { "id":"identity-windows-current-platform-evidence", "category":"regressionEvidence", "requirement":"Real Windows identity.current evidence executes through WindowsIdentity and WindowsPrincipal.", "hardGate":true, "evidence":{"type":"platform evidence","testProject":"tests/bOps.Packages.Identity.Windows.Tests/bOps.Packages.Identity.Windows.Tests.csproj","testName":"bOps.Packages.Identity.Windows.Tests.WindowsIdentityNativeTests.Current_UsesRealWindowsIdentityWithoutSensitiveFields","platform":"Windows"}, "status":"PENDING" },
    { "id":"identity-windows-users-groups-platform-evidence", "category":"regressionEvidence", "requirement":"Real Windows local users and direct local group members are enumerated with bounded output.", "hardGate":true, "evidence":{"type":"platform evidence","testProject":"tests/bOps.Packages.Identity.Windows.Tests/bOps.Packages.Identity.Windows.Tests.csproj","testName":"bOps.Packages.Identity.Windows.Tests.WindowsIdentityNativeTests.Groups_EnumeratesDirectMembersWithBounds","platform":"Windows"}, "status":"PENDING" },
    { "id":"identity-windows-sessions-platform-evidence", "category":"regressionEvidence", "requirement":"Real Windows session evidence executes through the bounded WTS path.", "hardGate":true, "evidence":{"type":"platform evidence","testProject":"tests/bOps.Packages.Identity.Windows.Tests/bOps.Packages.Identity.Windows.Tests.csproj","testName":"bOps.Packages.Identity.Windows.Tests.WindowsIdentityNativeTests.Sessions_UsesWtsAndKeepsNormalizedRowsBounded","platform":"Windows"}, "status":"PENDING" },
    { "id":"system-windows-time-reboot-platform-evidence", "category":"regressionEvidence", "requirement":"Real Windows system.time and system.reboot_pending smoke tests execute with environment-independent assertions.", "hardGate":true, "evidence":{"type":"platform evidence","testProject":"tests/bOps.Packages.System.Windows.Tests/bOps.Packages.System.Windows.Tests.csproj","testName":"bOps.Packages.System.Windows.Tests.WindowsSystemToolsTests.SystemTime_RealSmoke_IsTimezoneSafe","platform":"Windows"}, "status":"PENDING" },
    { "id":"system-windows-reboot-platform-evidence", "category":"regressionEvidence", "requirement":"Real Windows reboot-pending detector evidence is bounded and does not expose raw registry values.", "hardGate":true, "evidence":{"type":"platform evidence","testProject":"tests/bOps.Packages.System.Windows.Tests/bOps.Packages.System.Windows.Tests.csproj","testName":"bOps.Packages.System.Windows.Tests.WindowsSystemToolsTests.RebootPending_RealSmoke_IsBounded","platform":"Windows"}, "status":"PENDING" },